{
  "framework": {
    "slug": "systems-thinking",
    "name": "Systems Thinking",
    "category": "04-sensemaking-and-complex-systems",
    "wikipedia": "https://en.wikipedia.org/wiki/Systems_thinking",
    "one_liner": "Explains behaviour over time from structure: stocks that accumulate, flows that fill and drain them, closed feedback loops that are reinforcing or balancing, and the delays that make a corrected system oscillate."
  },
  "slots": [
    {
      "id": "stock",
      "label": "Stock",
      "typical_provenance": "either",
      "description": "An accumulation: users, cash, inventory, installed capacity, trust. A stock can only change through its flows, and it is what gives a system memory.",
      "color": "#569cd6",
      "shape": "box"
    },
    {
      "id": "flow",
      "label": "Flow",
      "typical_provenance": "either",
      "description": "A rate that fills or drains a stock: orders per week, capex per quarter, hires per month, churn.",
      "color": "#4ec9b0",
      "shape": "cone"
    },
    {
      "id": "variable",
      "label": "Variable",
      "typical_provenance": "either",
      "description": "An auxiliary quantity that influences a flow without accumulating: price, market share, perceived demand, sentiment.",
      "color": "#4fc1ff",
      "shape": "sphere"
    },
    {
      "id": "loop",
      "label": "Feedback loop",
      "typical_provenance": "derived",
      "description": "A closed chain of influence, reinforcing (R) when it has an even number of negative links and balancing (B) when odd. Almost never stated; this is the framework's real contribution.",
      "color": "#c586c0",
      "shape": "diamond"
    },
    {
      "id": "delay",
      "label": "Delay",
      "typical_provenance": "derived",
      "description": "A lag between cause and effect. A delay inside a balancing loop is what turns correction into oscillation and overshoot.",
      "color": "#ff9d5c",
      "shape": "diamond"
    },
    {
      "id": "leverage_point",
      "label": "Leverage point",
      "typical_provenance": "derived",
      "description": "Where a small intervention changes the system's behaviour. Meadows ranks them: parameters and delays low, stock-and-flow structure, information flows, rules, goals and paradigms high.",
      "color": "#b5cea8",
      "shape": "sphere"
    }
  ],
  "relations": [
    { "id": "inflow", "label": "inflow", "description": "a flow fills a stock" },
    { "id": "outflow", "label": "outflow", "description": "a flow drains a stock" },
    { "id": "influences", "label": "influences", "description": "one quantity influences another; the edge label carries the polarity + or -" },
    { "id": "part_of_loop", "label": "part of loop", "description": "this node is one link in the named feedback loop" },
    { "id": "delays", "label": "delays", "description": "a delay sits on the influence into this node" },
    { "id": "acts_on", "label": "acts on", "description": "a leverage point acts on this node" }
  ],
  "examples": [
    {
      "id": "classic",
      "kind": "classic",
      "title": "The Beer Distribution Game: a one-step rise in demand, an eight-week lag, and a glut",
      "summary": "Three tiers of one beer supply chain, each seeing only its own books, respond to a single permanent step up in customer demand. Nobody behaves irrationally, nobody lies, and every team still ends with inventories many times where they started, because the correcting loop is eight weeks long and the accumulation in transit is invisible.",
      "source": {
        "type": "text",
        "title": "The Beer Distribution Game (scenario text written for this example)",
        "attribution": "After the MIT Beer Distribution Game, developed in Jay Forrester's industrial-dynamics group and popularised by Peter Senge, The Fifth Discipline (1990), and John Sterman, Business Dynamics (2000).",
        "text": "In the Beer Distribution Game, a board game used in management classes since the 1960s, three players run one supply chain for a single brand of beer: a retailer, a wholesaler and a brewery. The retailer sells to customers from a case inventory on the shelf and orders replacements from the wholesaler. The wholesaler ships from its own warehouse inventory and orders from the brewery, and the brewery brews. Every order takes two weeks to reach the player upstream, and every shipment takes two more weeks to arrive, so eight weeks pass between a retailer's order and the beer landing on his shelf. Each player sees only his own inventory, his own incoming orders and his own backlog; nobody sees what the end customer is actually buying. In week five, customer demand doubles once, from four cases a week to eight, and then stays flat at eight for the rest of the game. The retailer's shelf inventory falls for several weeks and he cannot tell whether the rise will continue, so he orders more than he needs, to refill the shelf and to cover the backlog he has already accumulated. When the orders are larger than his own shipments, the wholesaler runs out of warehouse inventory and ships only part of what is asked for, so the retailer's backlog grows and his next order is larger still. The wholesaler sees a large order, reads it as a surge in demand, and orders more than that from the brewery. The brewery adds capacity and brews to the order book it can see. Around week twenty the accumulated orders all arrive at once, inventories across the chain reach many times their starting level, every player cancels, and the brewery is left with beer nobody ordered. Almost every team produces this oscillation and almost every team is surprised by it; the customer demand curve, shown to them afterwards, is a single step."
      },
      "layout": { "mode": "force" },
      "nodes": [
        {
          "id": "cs_shelf",
          "slot": "stock",
          "label": "Retailer shelf inventory",
          "text": "The cases standing on the retailer's shelf. Customers are served out of it and replacements arrive into it, so it is the stock whose level the retailer is trying to defend.",
          "provenance": "fact",
          "source_quote": "The retailer sells to customers from a case inventory on the shelf",
          "source_ref": "sentence 2"
        },
        {
          "id": "cs_ware",
          "slot": "stock",
          "label": "Wholesaler warehouse inventory",
          "text": "The wholesaler's own warehouse stock. He ships the retailer's orders out of it and the brewery's output comes into it.",
          "provenance": "fact",
          "source_quote": "The wholesaler ships from its own warehouse inventory",
          "source_ref": "sentence 3"
        },
        {
          "id": "cs_backlog",
          "slot": "stock",
          "label": "Retailer backlog",
          "text": "Orders the retailer has placed or promised and not yet been able to satisfy. It accumulates while shipments fall short and it is added on top of the next order.",
          "provenance": "fact",
          "source_quote": "to cover the backlog he has already accumulated",
          "source_ref": "sentence 7"
        },
        {
          "id": "cs_pipeline",
          "slot": "stock",
          "label": "Orders in the pipeline",
          "text": "Beer already ordered and not yet arrived. It is a real accumulation that nobody in the game tracks, which is why the same need is ordered more than once.",
          "provenance": "derived",
          "confidence": 0.85,
          "rationale": "The text gives the two-week order lag, the two-week shipping lag and the fact that around week twenty the accumulated orders all arrive at once. Anything that takes time in transit is by definition accumulating somewhere; naming that accumulation as a stock is the systems reading, and the text never does it."
        },
        {
          "id": "cs_glut",
          "slot": "stock",
          "label": "Chain-wide inventory glut",
          "text": "The end state: inventories across all three tiers many times their starting level, every player cancelling, and beer at the brewery that nobody ordered.",
          "provenance": "fact",
          "source_quote": "inventories across the chain reach many times their starting level, every player cancels",
          "source_ref": "sentence 11"
        },
        {
          "id": "cf_demand",
          "slot": "flow",
          "label": "Customer demand: 4 to 8 cases",
          "text": "The only exogenous input to the whole game: customer demand doubles once in week five, from four cases a week to eight, and then stays flat.",
          "provenance": "fact",
          "source_quote": "customer demand doubles once, from four cases a week to eight",
          "source_ref": "sentence 6"
        },
        {
          "id": "cf_order",
          "slot": "flow",
          "label": "Retailer's ordering rate",
          "text": "Cases the retailer orders from the wholesaler each week. He orders more than current sales, because he is refilling the shelf and covering the backlog at the same time.",
          "provenance": "fact",
          "source_quote": "he orders more than he needs, to refill the shelf",
          "source_ref": "sentence 7"
        },
        {
          "id": "cf_ship",
          "slot": "flow",
          "label": "Shipments reaching the shelf",
          "text": "Cases actually leaving the wholesaler and arriving at the retailer. When the warehouse is empty the wholesaler ships only part of what was asked for.",
          "provenance": "fact",
          "source_quote": "ships only part of what is asked for",
          "source_ref": "sentence 8"
        },
        {
          "id": "cf_wsorder",
          "slot": "flow",
          "label": "Wholesaler's ordering rate",
          "text": "Cases the wholesaler orders from the brewery. He orders more than the large order he has just received, because he is refilling his own warehouse as well.",